account_num,tag,tag_depth,crdr,value_sign,description,account_name,mean,median,std,min,max,count,quantile_25,quantile_75
1651,InterestExpenseTrustPreferredSecurities,2,D,1,"The amount of interest incurred to a trust which has issued trust-preferred securities. In order to issue trust preferred securities, a sponsor forms a trust by investing a nominal amount of cash to purchase all of the voting common stock of the trust. The trust issues nonvoting, mandatorily redeemable preferred securities to outside investors in exchange for cash. The proceeds received from the issuance of the preferred securities, together with the cash received for issuing the common stock to the sponsor, is then loaned to the sponsor in exchange for a note which has the same terms as the trust preferred securities. Trust preferred securities possesses characteristics of both equity and debt issues and are generally issued by bank holding companies.","interest expense, trust preferred securities",1630428.5714285714,1164000.0,1320646.9464405912,164000.0,4954000.0,21,589000.0,2120000.0
1652,FiniteLivedIntangibleAssetsNet,2,D,1,"Amount after amortization of assets, excluding financial assets and goodwill, lacking physical substance with a finite life.","finite-lived intangible assets, net",488084936.242615,36627000.0,1722259170.488103,388.0,29103000000.0,2065,4760000.0,220652000.0
1654,ValueAddedTaxReceivableNoncurrent,2,D,1,"Carrying amount due after one year of the balance sheet date (or one operating cycle), if longer of value added taxes due either from customers arising from sales on credit terms, or as previously overpaid to tax authorities.","value added tax receivable, noncurrent",10541841.888888888,7150000.0,16434209.628740458,1893510.0,53502000.0,9,2053290.0,8807000.0
1658,AmortizationMethodQualifiedAffordableHousingProjectInvestments,1,D,1,Amount of investment in qualified affordable housing projects.,amortization method qualified affordable housing project investments,327161125.0,304838000.0,286169767.30277604,56774000.0,624000000.0,8,60443750.0,599750000.0
1661,LeaseholdImprovementsGross,2,D,1,Amount before accumulated depreciation of additions or improvements to assets held under a lease arrangement.,"leasehold improvements, gross",93982781.752,1727000.0,313959809.9100946,5000.0,1875000000.0,125,735000.0,24693000.0
1663,DeferredCompensationPlanAssets,1,D,1,Carrying amount as of the balance sheet date of assets held under deferred compensation agreements.,deferred compensation plan assets,117582666.66666667,49022500.0,158124584.90197772,4148000.0,590300000.0,42,10140000.0,126384500.0
1665,InvestmentIncomeNet,2,C,-1,"Amount after accretion (amortization) of discount (premium), and investment expense, of interest income and dividend income on nonoperating securities.","investment income, net",-27400674.798771847,-2466000.0,139901557.80844373,-3742000000.0,-3.0,2117,-9000000.0,-454000.0
1666,FinancingReceivableAccruedInterestAfterAllowanceForCreditLoss,3,D,1,"Amount, after allowance for credit loss, of accrued interest on financing receivable.","financing receivable, accrued interest, after allowance for credit loss",66777273.333333336,96076000.0,50715667.86355279,1464926.0,106771000.0,6,24884035.5,98360750.0
1668,ForeignCurrencyTransactionGainLossRealized,2,C,-1,Amount before tax of foreign currency transaction realized gain (loss) recognized in the income statement.,"foreign currency transaction gain (loss), realized",-3906678.1238938053,-261395.0,15785921.461234143,-140209000.0,-9.0,113,-1618000.0,-58000.0
1672,OtherFiniteLivedIntangibleAssetsGross,2,D,1,Amount before accumulated amortization of finite-lived intangible assets classified as other.,"other finite-lived intangible assets, gross",519784000.0,86378000.0,758191828.5384343,532000.0,1990830000.0,23,4766000.0,925518500.0
1675,EmployeeServiceShareBasedCompensationTaxBenefitFromCompensationExpense,3,C,-1,Amount of tax benefit for recognition of expense of award under share-based payment arrangement.,"share-based payment arrangement, expense, tax benefit",-202333.33333333334,-203000.0,62650.35248637207,-300000.0,-102000.0,6,-205250.0,-200750.0
1676,DisposalGroupIncludingDiscontinuedOperationCostsOfGoodsSold,3,D,1,"Amount of costs of goods sold attributable to disposal group, including, but not limited to, discontinued operation.","disposal group, including discontinued operation, costs of goods sold",978000.0,978000.0,,978000.0,978000.0,1,978000.0,978000.0
1684,ReinsuranceCostsAndRecoveriesNet,4,C,-1,Amount of recovery (expense) related to provision for policy benefits and costs incurred for policies assumed and ceded.,"policyholder benefits, claims incurred, assumed, ceded",-36873434.6,-1958223.0,78810662.74746014,-177849040.0,-613361.0,5,-2449533.0,-1497016.0
1689,DebtSecuritiesAvailableForSaleRealizedGainLoss,3,C,-1,Amount of realized gain (loss) on investment in debt security measured at fair value with change in fair value recognized in other comprehensive income (available-for-sale).,"debt securities, available-for-sale, realized gain (loss)",-11322807.534412956,-354000.0,55781169.518089674,-404000000.0,-1000.0,247,-1585500.0,-45000.0
1690,FiniteLivedNoncompeteAgreementsGross,2,D,1,Gross carrying amount before accumulated amortization as of the balance sheet date of payments made to third parties in exchange for their agreement not to engage in specified competitive practices in specified geographic territories for a specified period of time.,"finite-lived noncompete agreements, gross",104927.0,104927.0,0.0,104927.0,104927.0,2,104927.0,104927.0
1692,DebtSecuritiesHeldToMaturityAmortizedCostAfterAllowanceForCreditLossNoncurrent,5,D,1,"Amount, after allowance for credit loss, of investment in debt security measured at amortized cost (held-to-maturity), classified as noncurrent.","debt securities, held-to-maturity, amortized cost, after allowance for credit loss, noncurrent",50300093.75,6411000.0,128107007.56395386,237000.0,451278000.0,32,948750.0,19073500.0
1700,DepositsAssetsNoncurrent,2,D,1,"Carrying value of amounts transferred to third parties for security purposes that are expected to be returned or applied towards payment after one year or beyond the operating cycle, if longer.","deposits assets, noncurrent",16621750.904347826,514000.0,78612558.38774565,500.0,623700000.0,345,91841.0,3007000.0
1702,InducedConversionOfConvertibleDebtExpense,1,D,1,Consideration given by issuer of convertible debt to provide an incentive for debt holders to convert the debt to equity securities. The expense is equal to the fair value of all securities and other consideration transferred in the transaction in excess of the fair value of securities issuable pursuant to the original conversion terms.,induced conversion of convertible debt expense,8003488.428571428,585632.0,17748060.249144804,86000.0,53889000.0,14,201750.0,1943321.75
1703,GainLossOnSaleOfMortgageLoans,1,C,-1,The gains (losses) included in earnings that represent the difference between the sale price and the carrying value of loans made to finance real estate acquisitions. This element refers to the gain (loss) and not to the cash proceeds of the sale. This element is a noncash adjustment to net income when calculating net cash generated by operating activities using the indirect method.,gain (loss) on sale of mortgage loans,-3845456.066945607,-813000.0,17123064.30736982,-239000000.0,-2000.0,239,-2189000.0,-228500.0
1705,PropertyPlantAndEquipmentGross,4,D,1,"Amount before accumulated depreciation, depletion and amortization of physical assets used in the normal conduct of business and not intended for resale. Examples include, but are not limited to, land, buildings, machinery and equipment, office equipment, and furniture and fixtures.","property, plant, equipment, gross",7310674114.651073,1102783500.0,21938852072.470657,19000.0,316767000000.0,1304,121968000.0,5717928000.0
1708,GainLossOnSalesOfLoansNet,2,C,-1,"The net gain (loss) resulting from a sale of loans, including adjustments to record loans classified as held-for-sale at the lower-of-cost-or-market and fair value adjustments to loan held for investment purposes.","gain (loss) on sales of loans, net",-4817441.415789474,-662500.0,19530832.638393827,-302384000.0,-1000.0,760,-2445500.0,-126500.0
1709,InterestExpense,1,D,1,Amount of the cost of borrowed funds accounted for as interest expense.,interest expense,213863697.6623906,17133000.0,2284197857.477024,111.0,134144000000.0,6626,2915925.0,70000000.0
1711,Goodwill,1,D,1,Amount after accumulated impairment loss of an asset representing future economic benefits arising from other assets acquired in a business combination that are not individually identified and separately recognized.,goodwill,2120641752.8047523,221069500.0,6878053008.774002,562.0,93352000000.0,6986,29136000.0,1196000000.0
1713,IndefiniteLivedContractualRights,1,D,1,Carrying amount (original costs adjusted for previously recognized amortization and impairment) as of the balance sheet date of rights with an indefinite period of benefit that arose from a contractual arrangement with a third party (not including franchise rights and license agreements).,indefinite-lived contractual rights,50012250.0,50039000.0,47987219.86335826,4990000.0,95100000.0,8,5176500.0,94825000.0
1715,InterestExpenseCapitalSecurities,2,D,1,Interest expense incurred during the reporting period on capital securities issued by the reporting entity.,"interest expense, capital securities",2117551.724137931,459000.0,3780557.608023743,3000.0,15000000.0,29,192000.0,2000000.0
1716,GainLossOnInterestRateDerivativeInstrumentsNotDesignatedAsHedgingInstruments,1,C,-1,Amount of gain (loss) included in earnings for the period from the increase (decrease) in fair value of interest rate derivatives not designated as hedging instruments.,gain (loss) on interest rate derivative instruments not designated as hedging instruments,-39873107.14285714,-14714500.0,72934180.87834744,-293000000.0,-195000.0,28,-33808250.0,-3965750.0
1721,CapitalizedContractCostNetNoncurrent,3,D,1,"Amount, after accumulated amortization and accumulated impairment loss, of asset recognized from cost incurred to obtain or fulfill contract with customer; classified as noncurrent.","capitalized contract cost, net, noncurrent",141373602.9003984,22115000.0,381470221.63752806,24114.0,2697000000.0,251,6691000.0,62387500.0
1723,GainsLossesOnSalesOfOtherRealEstate,1,C,-1,"The net gain (loss) resulting from sales and other disposals of other real estate owned, increases (decreases) in the valuation allowance for foreclosed real estate, and write-downs of other real estate owned after acquisition or physical possession.",gains (losses) on sales of other real estate,-790883.9898989899,-96000.0,2779255.9826925234,-33008000.0,-1000.0,297,-422000.0,-22000.0
1728,NetPeriodicDefinedBenefitsExpenseReversalOfExpenseExcludingServiceCostComponent,2,D,1,"Amount of expense (reversal of expense) for net periodic benefit cost components, excluding service cost component, of defined benefit plan. Amount includes, but is not limited to, interest cost, expected (return) loss on plan asset, amortization of prior service cost (credit), amortization of (gain) loss, amortization of transition (asset) obligation, settlement (gain) loss, curtailment (gain) loss and certain termination benefits.","net periodic defined benefits expense (reversal of expense), excluding service cost component",58832500.0,6290000.0,193550712.11319247,25000.0,1889000000.0,210,810000.0,30500000.0
1729,DisposalGroupIncludingDiscontinuedOperationOtherCurrentAssets,4,D,1,"Amount classified as other assets attributable to disposal group held for sale or disposed of, expected to be disposed of within one year or the normal operating cycle, if longer.","disposal group, including discontinued operation, other assets, current",70723.0,70723.0,,70723.0,70723.0,1,70723.0,70723.0
1731,TravelAndEntertainmentExpense,2,D,1,Expenses incurred for travel and entertainment during the period.,"travel, entertainment expense",11573512.040816326,876000.0,23913502.858918037,1231.0,111989000.0,49,126388.0,11101000.0
1732,IntangibleAssetsNetExcludingGoodwill,2,D,1,"Sum of the carrying amounts of all intangible assets, excluding goodwill, as of the balance sheet date, net of accumulated amortization and impairment charges.","intangible assets, net (excluding goodwill)",1099906564.078966,60700000.0,6757801610.403258,388.0,166417000000.0,7079,8483000.0,358950000.0
1734,OilAndGasPropertyFullCostMethodNet,4,D,1,"Oil and gas properties, net of depletion, carried under the full cost method.","oil, gas property, full cost method, net",7426583764.520833,236411500.0,13992617951.046906,711546.0,40647000000.0,48,2268179.5,4854403500.0
1738,PropertyPlantAndEquipmentCollectionsNotCapitalized,6,D,1,"Amount not capitalized of work of art, historical treasure, and similar asset classified as collections.","property, plant,, equipment, collections, not capitalized",150.0,125.0,43.30127018922193,125.0,200.0,3,125.0,162.5
1739,BusinessCombinationAcquisitionRelatedCosts,2,D,1,"This element represents acquisition-related costs incurred to effect a business combination which costs have been expensed during the period. Such costs include finder's fees; advisory, legal, accounting, valuation, and other professional or consulting fees; general administrative costs, including the costs of maintaining an internal acquisitions department; and may include costs of registering and issuing debt and equity securities.","business combination, acquisition related costs",15265367.887559809,2581500.0,38502019.60798027,2020.0,354000000.0,418,537000.0,9305000.0
1745,BusinessExitCosts1,1,D,1,"Amount of expenses associated with exit or disposal activities pursuant to an authorized plan. Includes, but is not limited to, one-time termination benefits, termination of an operating lease or other contract, consolidating or closing facilities, and relocating employees, and termination benefits associated with an ongoing benefit arrangement. Excludes expenses associated with special or contractual termination benefits, a discontinued operation or an asset retirement obligation.",business exit costs,15825181.818181818,1992000.0,32828534.87080464,121000.0,111000000.0,11,1398500.0,9982000.0
1746,OtherRestrictedAssetsNoncurrent,2,D,1,"Amount of noncurrent assets that are pledged or subject to withdrawal restrictions, classified as other.","other restricted assets, noncurrent",327541374.3125,1388500.0,584706318.2802035,113139.0,1355000000.0,16,596417.5,306416750.0
1749,SalariesWagesAndOfficersCompensation,4,D,1,"Amount of expense for salary and wage arising from service rendered by nonofficer and officer employees. Excludes allocated cost, labor-related nonsalary expense, and direct and overhead labor cost included in cost of good and service sold.","salary, wage, excluding cost of good, service sold",22912994.43548387,6651000.0,35821245.534325264,16219.0,242408000.0,186,1547208.0,29717000.0
1751,EquitySecuritiesFVNINoncurrent,3,D,1,"Amount of investment in equity security measured at fair value with change in fair value recognized in net income (FV-NI), classified as noncurrent.","equity securities, fv-ni, noncurrent",33269344.529411763,5618762.5,80643859.72397609,1000.0,384900000.0,68,670951.0,26102500.0
1756,OilAndGasPropertySuccessfulEffortMethodAccumulatedDepreciationDepletionAndAmortization,6,C,-1,"Amount of accumulated depreciation, depletion and amortization of oil and gas property carried under the successful effort method. Oil and gas property include, but not limited to, the entity's wells and related equipment and facilities.","oil, gas property, successful effort method, accumulated depreciation, depletion, amortization",-3082000505.2325583,-832886000.0,4635875012.105499,-16876000000.0,-52773978.0,43,-4807930000.0,-110784263.5
1763,NotesAndLoansReceivableGrossNoncurrent,3,D,1,"Amortized cost, before allowance for credit loss, of financing receivable classified as noncurrent. Excludes net investment in lease.","financing receivable, before allowance for credit loss, noncurrent",326990690.5714286,50022000.0,494948928.2213997,27834.0,1051000000.0,7,40251500.0,553691000.0
1765,PrepaidExpenseOtherNoncurrent,2,D,1,"Carrying amount as of the balance sheet date of amounts paid in advance which will be charged against earnings in periods after one year or beyond the operating cycle, if longer.","prepaid expense other, noncurrent",3757425.117647059,916823.0,5083511.21799983,8414.0,16248181.0,17,41774.0,9185377.0
1768,RestrictedInvestmentsNoncurrent,2,D,1,"This element represents the noncurrent portion of investments which are not defined as or included in marketable (debt, equity, or other) securities that are pledged or subject to withdrawal restrictions.","restricted investments, noncurrent",54343145.45454545,7025000.0,98228848.87407874,33000.0,386994000.0,55,2124500.0,72172000.0
1772,DisposalGroupIncludingDiscontinuedOperationOperatingExpense,3,D,1,"Amount of operating expense attributable to disposal group, including, but not limited to, discontinued operation.","disposal group, including discontinued operation, operating expense",5274000.0,5274000.0,,5274000.0,5274000.0,1,5274000.0,5274000.0
1773,GainLossFromPriceRiskManagementActivity,1,C,-1,Gain (loss) incurred in risk management activities.,gain (loss) from price risk management activity,-245660272.72727272,-58937000.0,544893479.0911139,-1867000000.0,-1321000.0,11,-170000000.0,-8645500.0
1774,AircraftRental,1,D,1,Expenses incurred related to the lease of aircraft from outside third parties that are used in the entity's business operations.,aircraft rental,204922888.8888889,104423000.0,295724035.4100209,1480000.0,1395000000.0,36,31042750.0,266690250.0
1778,InterestExpenseDebt,2,D,1,Amount of the cost of borrowed funds accounted for as interest expense for debt.,"interest expense, debt",85946203.86651583,16094000.0,198746602.13352925,2000.0,1787000000.0,442,2570750.0,77650000.0
1780,FiniteLivedTrademarksGross,2,D,1,"Gross carrying amount before accumulated amortization as of the balance sheet date for the rights acquired through registration of a trademark to gain or protect exclusive use of a business name, symbol or other device or style for a specified period of time.","finite-lived trademarks, gross",306893.5,50000.0,505417.30257763946,2500.0,1125074.0,8,38125.0,318768.5
1781,NonoperatingGainsLosses,1,C,-1,"The aggregate amount of gains or losses resulting from nonoperating activities (for example, interest and dividend revenue, property, plant and equipment impairment loss, and so forth).",nonoperating gains (losses),-135236813.31924614,-4500000.0,627005688.6430559,-9891000000.0,-224.0,1751,-36803500.0,-609608.5
1782,OtherNonrecurringIncomeExpense,1,D,1,Amount of other expense (income) that is infrequent in occurrence or unusual in nature.,other nonrecurring (income) expense,12113395.887096774,1698500.0,26031352.749874804,15000.0,140500000.0,62,558000.0,9000000.0
1786,FloorBrokerageExchangeAndClearanceFees,3,D,1,"The amount of expense during the period for floor brokerage fees paid to other broker-dealers to execute trades on their behalf, stock exchange fees, order flow fees, and clearance fees.","floor brokerage, exchange, clearance fees",360099887.23913044,154060500.0,670148618.7348591,355000.0,3458000000.0,46,12752500.0,348163500.0
1792,IncomeTaxExpenseBenefitContinuingOperationsGovernmentGrants,3,C,-1,Amount of tax (expense) benefit from continuing operations attributable to government grants to the extent recognized as a reduction of income tax expense.,"income tax (expense) benefit, continuing operations, government grants",-468896.85714285716,-148902.0,607479.1730014093,-1639328.0,-9838.0,7,-715378.0,-26727.0
1794,OtherNonoperatingIncome,1,C,-1,"Amount of income related to nonoperating activities, classified as other.",other nonoperating income,-10086461.570422536,-349500.0,36203779.3374134,-425000000.0,-519.0,284,-3764500.0,-51576.25
1800,DebtSecuritiesRealizedGainLoss,2,C,-1,"Amount of realized gain (loss) on investment in debt security measured at fair value with change in fair value recognized in other comprehensive income (available-for-sale), investment in debt security measured at amortized cost (held-to-maturity) and investment in debt security measured at fair value with change in fair value recognized in net income (trading).","debt securities, realized gain (loss)",-9640382.829721361,-336000.0,49364335.10826132,-404000000.0,-1000.0,323,-1921500.0,-44500.0
1801,LongTermAccountsNotesAndLoansReceivableNetNoncurrent,4,D,1,"Amount, after allowance for credit loss, of accounts and financing receivables, classified as noncurrent. Includes, but is not limited to, notes and loan receivable.","accounts, financing receivable, after allowance for credit loss, noncurrent",907891874.5439814,12411000.0,5129794887.404612,1313.0,53434000000.0,432,1784526.5,106173750.0
1804,DisposalGroupIncludingDiscontinuedOperationForeignCurrencyTranslationGainsLosses,3,C,-1,"Amount of foreign currency translation gain (loss) in the disposal group, including discontinued operation, recognized in the statement of income as a result of the sale or complete or substantially complete liquidation of an investment in a foreign entity.","disposal group, including discontinued operation, foreign currency translation gains (losses)",-146753.5,-146753.5,62574.00038754115,-191000.0,-102507.0,2,-168876.75,-124630.25
1808,MachineryAndEquipmentGross,3,D,1,"Amount before accumulated depreciation of tangible personal property used to produce goods and services, including, but is not limited to, tools, dies and molds, computer and office equipment.","machinery, equipment, gross",1344910837.192073,146850000.0,3671439756.4691787,11000.0,29981000000.0,328,9845750.0,1118786250.0
1810,InterestExpenseOther,2,D,1,Amount of interest expense classified as other.,"interest expense, other",28455739.837278105,2000000.0,109799123.56940964,1000.0,1259000000.0,338,342079.75,12019500.0
1820,IncomeLossFromContinuingOperationsIncludingPortionAttributableToNoncontrollingInterest,3,C,-1,Amount after tax of income (loss) from continuing operations including portion attributable to the noncontrolling interest.,"income (loss) from continuing operations, net of tax, including portion attributable to noncontrolling interest",-649118431.7694635,-65680000.0,3611386766.2166634,-172515000000.0,-1000.0,9582,-294983250.0,-14462803.5
1822,DiscontinuedOperationGainLossFromDisposalOfDiscontinuedOperationBeforeIncomeTax,3,C,-1,Amount before tax of gain (loss) not previously recognized resulting from the disposal of a discontinued operation.,"discontinued operation, gain (loss) from disposal of discontinued operation, before income tax",-61485809.342857145,-23107066.0,99664138.3240534,-389905000.0,-279000.0,35,-58567000.0,-2321944.0
1827,IntangibleAssetsNetIncludingGoodwill,2,D,1,"Carrying amount of finite-lived intangible assets, indefinite-lived intangible assets and goodwill. Goodwill is an asset representing the future economic benefits arising from other assets acquired in a business combination that are not individually identified and separately recognized. Intangible assets are assets, not including financial assets, lacking physical substance.","intangible assets, net (including goodwill)",2747243678.028478,210247000.0,11097421719.20702,388.0,200299000000.0,8287,25933000.0,1214261000.0
1831,IndefiniteLivedFranchiseRights,1,D,1,Carrying amount (original costs adjusted for previously recognized amortization and impairment) as of the balance sheet date for the rights acquired through a franchise arrangement having an indefinite period of benefit.,indefinite-lived franchise rights,7917404950.76,719800000.0,19404606767.900593,1800769.0,59365000000.0,25,325300000.0,1856200000.0
1832,ConvertiblePreferredDividendsNetOfTax,2,C,-1,The after-tax amount of any dividends on convertible preferred stock.,"convertible preferred dividends, net of tax",-2716800.0,-1950000.0,2920466.5209517465,-7721000.0,-13000.0,5,-1950000.0,-1950000.0
1834,InsuranceCommissions,1,D,1,"The expense incurred by an insurance company to persons or entities for generating or placing insurance or investment contracts with the company, usually determined as a percentage of policy or contract premiums. Excludes advances or draws to be applied against commissions earned.",insurance commissions,458262394.71428573,199869000.0,619823072.3181419,463661.0,3064000000.0,70,18870750.0,644250000.0
1837,InventoryRealEstateConstructionInProcess,3,D,1,"Cost of real estate projects incurred for projects for eventual sale or transfer (condominium or time share projects, vacation clubs).","inventory, real estate, construction in process",91069.0,91069.0,17765.35077053082,78507.0,103631.0,2,84788.0,97350.0
1838,OilAndGasPropertySuccessfulEffortMethodNet,4,D,1,"Oil and gas properties net of accumulated depreciation, depletion, amortization, impairment, and abandonment, carried under the successful effort method.","oil, gas property, successful effort method, net",10038522047.40244,5870296500.0,15339709525.207245,1224588.0,70730000000.0,82,515076000.0,12880500000.0
