account_num,tag,tag_depth,crdr,value_sign,description,account_name,mean,median,std,min,max,count,quantile_25,quantile_75
2580,InventoryGasInStorageUndergroundNoncurrent,3,D,1,"Carrying amount as of the balance sheet date of natural gas stored underground in depleted gas reservoirs, aquifers, or salt caverns to meet future seasonal and peak load demands and also as insurance against unforeseen supply disruptions, and deemed to be a noncurrent asset because it is not expected to be used within 12 months or in the normal operating cycle.","inventory, gas in storage underground, noncurrent",110475000.0,98700000.0,28913938.391947463,91000000.0,153500000.0,4,96475000.0,112700000.0
2590,NetIncomeLossAvailableToCommonStockholdersBasic,2,C,-1,"Amount, after deduction of tax, noncontrolling interests, dividends on preferred stock and participating securities; of income (loss) available to common shareholders.","net income (loss) available to common stockholders, basic",-390790153.9927844,-44217500.0,1807283387.995501,-72361000000.0,-0.26,9582,-192448250.0,-9603718.25
2591,AccountsPayableOtherCurrent,3,C,-1,"Amount of obligations incurred classified as other, payable within one year or the normal operating cycle, if longer.","accounts payable, other, current",-253435741.82978722,-16889500.0,486904239.67023027,-2276000000.0,-4880.0,94,-173748750.0,-1554531.75
2596,SecuritiesSoldUnderAgreementsToRepurchase,1,C,-1,"Amount, after the effects of master netting arrangements, of funds outstanding borrowed in the form of a security repurchase agreement between the entity and another party for the sale and repurchase of identical or substantially the same securities at a date certain for a specified price. Includes liabilities not subject to a master netting arrangement and not elected to be offset.",securities sold under agreements to repurchase,-4632283800.650794,-132138000.0,25540947501.781334,-225679000000.0,-340000.0,252,-368050500.0,-25000000.0
2601,NotesAndLoansPayableCurrent,3,C,-1,Sum of the carrying values as of the balance sheet date of the portions of all long-term notes and loans payable due within one year or the operating cycle if longer.,"notes, loans payable, current",-61075687.21480805,-2158792.5,366237510.8172213,-6321000000.0,-480.0,1094,-10098500.0,-438390.5
2603,NoninterestIncome,1,C,-1,The total amount of noninterest income which may be derived from: (1) fees and commissions; (2) premiums earned; (3) insurance policy charges; (4) the sale or disposal of assets; and (5) other sources not otherwise specified.,noninterest income,-3076628527.547495,-290242000.0,16821309214.017168,-605881000000.0,-7419.0,5748,-1417381250.0,-32000000.0
2604,IncomeLossFromAffordableHousingProjectsEquityMethodInvestments,2,C,-1,Amount of investment income (loss) of qualified affordable housing project investments accounted for using the equity method.,"income (loss) from affordable housing projects, equity method investments",-6853000.0,-6845000.0,3517367.576280117,-10961000.0,-2761000.0,4,-8865500.0,-4832500.0
2608,AccountsPayableUnderwritersPromotersAndEmployeesOtherThanSalariesAndWagesCurrent,6,C,-1,"Amount of obligation to underwriters, promoters, and employees excluding salaries, wages and amount to related party, classified as current.","accounts payable, underwriters, promoters,, employees, current",-259311875.0,-334015000.0,161289782.2646622,-373825000.0,-200000.0,8,-358202250.0,-232034750.0
2609,AccruedRentCurrent,2,C,-1,Carrying value as of the balance sheet date of obligations incurred through that date and payable for contractual rent under lease arrangements. Used to reflect the current portion of the liabilities (due within one year or within the normal operating cycle if longer).,"accrued rent, current",-60525000.0,-61800000.0,11444467.367830332,-72800000.0,-45700000.0,4,-66875000.0,-55450000.0
2614,PreferredStockDividendsIncomeStatementImpact,2,D,1,The amount of preferred stock dividends that is an adjustment to net income apportioned to common stockholders.,"preferred stock dividends, income statement impact",25494318.95190713,4117000.0,86648795.62322435,4000.0,1343000000.0,603,991500.0,15158500.0
2621,AccruedEnvironmentalLossContingenciesCurrent,2,C,-1,"Carrying value of the obligation (known or estimated) arising from requirements to perform activities to remediate one or more sites, payable in twelve months or in the next operating cycle if longer.","accrued environmental loss contingencies, current",-24314825.0,-4773000.0,48599545.4404655,-194000000.0,-600000.0,40,-12076500.0,-1390000.0
2625,ShortTermBankLoansAndNotesPayable,2,C,-1,"Amount of borrowings from a bank classified as other, maturing within one year or operating cycle, if longer.","short-term bank loans, notes payable",-306942281.4402516,-7900000.0,1175878392.270545,-10061000000.0,-185000.0,159,-69354000.0,-2774150.0
2631,LoansPayableToBankCurrent,2,C,-1,Carrying value as of the balance sheet date of current portion of long-term loans payable to bank due within one year or the operating cycle if longer.,"loans payable to bank, current",-20581605.866666667,-3549791.0,41648033.68273621,-205192000.0,-2733.0,60,-20619300.25,-462000.0
2634,PreferredStockRedemptionDiscount,1,C,-1,"The excess of (1) the carrying amount of the preferred stock in the registrant's balance sheet over (2) the fair value of the consideration transferred to the holders of the preferred stock, during the accounting period, which will be added to net earnings to arrive at net earnings available to common shareholders in the calculation of earnings per share.",preferred stock redemption discount,-36300151.307692304,-596931.0,83791451.21512608,-289298029.0,-3000.0,13,-20149000.0,-37000.0
2638,DebtCurrent,2,C,-1,"Amount of debt and lease obligation, classified as current.","debt, current",-622871389.6232939,-20058000.0,5814982918.487318,-225679000000.0,-597.0,6594,-143000000.0,-3308374.75
2644,TemporaryEquityDividendsAdjustment,3,D,1,"Accretion of temporary equity during the period due to cash, stock, and in-kind dividends. This item is an adjustment to net income necessary to derive net income apportioned to common stockholders and is to be distinguished from Temporary Equity, Accretion of Dividends (Temporary Equity, Accretion of Dividends).","temporary equity, dividends, adjustment",7405628.666666667,2600000.0,11684203.620931037,161466.0,58512000.0,72,755466.5,8812500.0
2646,ConvertibleDebtCurrent,2,C,-1,"The portion of the carrying value of long-term convertible debt as of the balance sheet date that is scheduled to be repaid within one year or in the normal operating cycle if longer. Convertible debt is a financial instrument which can be exchanged for a specified amount of another security, typically the entity's common stock, at the option of the issuer or the holder.","convertible debt, current",-153466270.5670103,-6019635.0,479038781.62343526,-3682100000.0,-8000.0,194,-58501000.0,-1609685.25
2649,BankOverdrafts,1,C,-1,"Carrying value as of the balance sheet date of payments made in excess of existing cash balances, which will be honored by the bank but reflected as a loan to the entity. Overdrafts generally have a very short time frame for correction or repayment and are therefore more similar to short-term bank financing than trade financing.",bank overdrafts,-10577360.505050505,-771000.0,28670093.17142203,-199000000.0,-506.0,99,-13038888.5,-27918.0
2655,AccruedPayrollTaxesCurrent,2,C,-1,"Carrying value as of the balance sheet date of obligations incurred and payable for statutory payroll taxes incurred through that date and withheld from employees pertaining to services received from them, including entity's matching share of the employees FICA taxes and contributions to the state and federal unemployment insurance programs. Used to reflect the current portion of the liabilities (due within one year or within the normal operating cycle if longer).","accrued payroll taxes, current",-101003480.16666667,-1747858.5,227033428.48593816,-746700000.0,-60215.0,48,-7538538.25,-490185.0
2657,AccruedVacationCurrent,2,C,-1,Carrying value as of the balance sheet date of obligations incurred and payable for unused vacation time owed to employees based on the entity's vacation benefit given to its employees. Used to reflect the current portion of the liabilities (due within one year or within the normal operating cycle if longer).,"accrued vacation, current",-44889397.0,-11219000.0,65930839.27042598,-159168000.0,-332617.0,16,-48549500.0,-6403750.0
2661,LongtermFederalHomeLoanBankAdvancesNoncurrent,2,C,-1,The noncurrent portion of Federal Home Loan Bank borrowings initially due beyond one year or beyond the normal operating cycle if longer.,"long-term federal home loan bank advances, noncurrent",-23063500.0,-25511000.0,20587492.8658154,-46022000.0,-1808000.0,10,-41772000.0,-2410750.0
2669,SettlementLiabilitiesCurrent,2,C,-1,"Amounts payable for money transfers, money orders, and consumer payment service arrangements. Settlement liabilities include amounts payable to intermediaries for global payment transfers.","settlement liabilities, current",-1648084743.5588236,-44680500.0,4407560825.256424,-21785000000.0,-154562.0,68,-710188750.0,-14027000.0
2670,WarrantDownRoundFeatureDecreaseInNetIncomeLossToCommonShareholderAmount,4,D,1,Amount of decrease in net income available to common shareholder for down round feature triggered for warrant classified as equity.,"warrant, down round feature, decrease in net income to common shareholder, amount",823000.0,789000.0,277566.2083179435,564000.0,1116000.0,3,676500.0,952500.0
2672,AccruedEmployeeBenefitsCurrent,2,C,-1,"Carrying value as of the balance sheet date of obligations, excluding pension and other postretirement benefits, incurred through that date and payable for perquisites provided to employees pertaining to services received from them. Used to reflect the current portion of the liabilities (due within one year or within the normal operating cycle if longer).","accrued employee benefits, current",-66640446.86111111,-23702500.0,123697443.5931201,-918489000.0,-54142.0,108,-56630000.0,-4522250.0
2673,EmployeeRelatedLiabilitiesCurrent,2,C,-1,"Total of the carrying values as of the balance sheet date of obligations incurred through that date and payable for obligations related to services received from employees, such as accrued salaries and bonuses, payroll taxes and fringe benefits. Used to reflect the current portion of the liabilities (due within one year or within the normal operating cycle if longer).","employee-related liabilities, current",-211573399.36161035,-35700000.0,761553599.044636,-14028000000.0,-15471.0,2782,-126365250.0,-9414500.0
2676,BusinessCombinationContingentConsiderationLiabilityCurrent,4,C,-1,"Amount of liability recognized arising from contingent consideration in a business combination, expected to be settled within one year or the normal operating cycle, if longer.","business combination, contingent consideration, liability, current",-16312967.641509434,-3575500.0,53711851.72758653,-620040000.0,-1102.0,318,-13177500.0,-875500.0
2678,DeferredCompensationCashBasedArrangementsLiabilityCurrent,3,C,-1,"Aggregate carrying value as of the balance sheet date of the liabilities for deferred compensation arrangements payable within one year (or the normal operating cycle, if longer). Represents currently earned compensation under cash arrangements (such as a profit-sharing plan, rabbi trust, and employee contract--excluding equity-based arrangements) that is not actually paid until a later date.","deferred compensation cash-based arrangements, liability, current",-61120571.428571425,-8587000.0,91661579.53767031,-228800000.0,-266000.0,14,-120165500.0,-638500.0
2689,LinesOfCreditCurrent,2,C,-1,"The carrying value as of the balance sheet date of the current portion of long-term obligations drawn from a line of credit, which is a bank's commitment to make loans up to a specific amount. Examples of items that might be included in the application of this element may consist of letters of credit, standby letters of credit, and revolving credit arrangements, under which borrowings can be made up to a maximum amount as of any point in time conditional on satisfaction of specified terms before, as of and after the date of drawdowns on the line. Includes short-term obligations that would normally be classified as current liabilities but for which (a) postbalance sheet date issuance of a long term obligation to refinance the short term obligation on a long term basis, or (b) the enterprise has entered into a financing agreement that clearly permits the enterprise to refinance the short-term obligation on a long term basis and the following conditions are met (1) the agreement does not expire within 1 year and is not cancelable by the lender except for violation of an objectively determinable provision, (2) no violation exists at the BS date, and (3) the lender has entered into the financing agreement is expected to be financially capable of honoring the agreement.","line of credit, current",-72710837.65492958,-16672000.0,136923043.08074078,-1209000000.0,-4885.0,426,-77575000.0,-2685351.75
2693,SecuritiesLoaned,1,C,-1,"Amount, after the effects of master netting arrangements, of securities loaned to entities in exchange for collateral. Includes liabilities not subject to a master netting arrangement and not elected to be offset.",securities loaned,-9441184250.0,-1438231500.0,15871568635.59508,-54926000000.0,-327180000.0,28,-13140250000.0,-1052208000.0
2698,ExtendedProductWarrantyAccrualCurrent,2,C,-1,"Amount at end of the reporting period of the aggregate extended product warranty liability that is expected to be paid within one year of the balance sheet date or normal operating cycle, if longer. Does not include the balance for the standard product warranty liability.","extended product warranty accrual, current",-3206514.8571428573,-9987.0,3991519.3675545584,-7769000.0,-7685.0,7,-7321000.0,-8466.0
2699,CustomerRefundLiabilityNoncurrent,2,C,-1,Noncurrent regulatory liabilities generally represent obligations to make refunds to customers for various reasons including overpayment.,"customer refund liability, noncurrent",-50684750.0,-50684500.0,11628702.689896239,-60762000.0,-40608000.0,4,-60752250.0,-40617000.0
2700,SalesAndExciseTaxPayableCurrent,3,C,-1,"Carrying value as of the balance sheet date of liabilities incurred through that date and payable for statutory sales and use taxes, including value added tax. Used to reflect the current portion of the liabilities (due within one year or within the normal operating cycle if longer).","sales, excise tax payable, current",-424079202.9305556,-6105000.0,1409050680.145323,-7440000000.0,-35254.0,72,-79250000.0,-2125750.0
2705,OtherShortTermBorrowings,1,C,-1,"Amount of borrowings classified as other, maturing within one year or the normal operating cycle, if longer.",other short-term borrowings,-1993513854.9,-152979000.0,7663299994.44365,-56564000000.0,-208001.0,120,-579750000.0,-25000000.0
2706,AccruedSalesCommissionCurrent,2,C,-1,Carrying value as of the balance sheet date of obligations incurred through that date and payable for sales commissions. Used to reflect the current portion of the liabilities (due within one year or within the normal operating cycle if longer).,"accrued sales commission, current",-37285998.711538464,-6921469.0,87306696.13344394,-357614000.0,-20363.0,52,-20911250.0,-2394713.75
2710,DeferredRevenueCurrent,2,C,-1,"Amount of deferred income and obligation to transfer product and service to customer for which consideration has been received or is receivable, classified as current.","deferred revenue, current",-436345147.0461458,-20559500.0,2641187005.0528064,-55924000000.0,-996.0,3814,-140201250.0,-2739356.0
2712,AccruedAdvertisingCurrent,2,C,-1,Carrying value as of the balance sheet date of obligations incurred through that date and payable for advertising of the entity's goods and services. Used to reflect the current portion of the liabilities (due within one year or within the normal operating cycle if longer).,"accrued advertising, current",-510204230.7692308,-128350000.0,911466581.1641502,-2704000000.0,-2254000.0,26,-448000000.0,-13504000.0
2716,LongTermDebtCurrent,2,C,-1,"Amount, after deduction of unamortized premium (discount) and debt issuance cost, of long-term debt classified as current. Excludes lease obligation.","long-term debt, current maturities",-146498115.65195823,-9867304.0,615871735.0664774,-14827000000.0,-244.0,3830,-45857000.0,-2083000.0
2721,SharesSubjectToMandatoryRedemptionSettlementTermsAmountCurrent,5,C,-1,"The amount that is required to be paid, determined under the conditions specified in the contract, if as of the reporting date, the holder of the share has exercised the right to or the shares are mandatorily redeemable within one year of the reporting date or operating cycle, if longer.","financial instruments subject to mandatory redemption, settlement terms, share value, amount, current",-8561948.666666666,-9864014.0,7990053.78494146,-15821000.0,-832.0,3,-12842507.0,-4932423.0
2722,LoansPayableCurrent,2,C,-1,Carrying value as of the balance sheet date of portion of long-term loans payable due within one year or the operating cycle if longer.,"loans payable, current",-19707404.40647482,-852000.0,85524386.080158,-749000000.0,-2733.0,278,-5084000.0,-158702.75
2723,InterestAndDividendsPayableCurrent,3,C,-1,"Sum of the carrying values as of the balance sheet date of (a) interest payable on all forms of debt, including trade payables, that has been incurred, and (b) dividends declared but unpaid on equity securities issued by the entity and outstanding (also includes dividends collected on behalf of another owner of securities that are being held by the entity). Used to reflect the current portion of the liabilities (due within one year or within the normal operating cycle if longer).","interest, dividends payable, current",-105489594.41406946,-14456000.0,319658337.3078856,-4602000000.0,-123.0,1123,-74096500.0,-1940000.0
2727,DeferredCompensationShareBasedArrangementsLiabilityCurrent,3,C,-1,"Aggregate carrying value as of the balance sheet date of the liabilities for stock option plans and other equity-based compensation arrangements payable within one year (or the operating cycle, if longer).","deferred compensation share-based arrangements, liability, current",-2150300.0,-1000500.0,3240714.345494047,-11400000.0,-60900.0,12,-2834250.0,-60900.0
2731,ShortTermBorrowings,1,C,-1,"Reflects the total carrying amount as of the balance sheet date of debt having initial terms less than one year or the normal operating cycle, if longer.",short-term debt,-1500600332.754668,-65790500.0,10597335843.06646,-225679000000.0,-506.0,1928,-359208000.0,-8222240.0
2737,LongTermDebtAndCapitalLeaseObligationsCurrent,3,C,-1,"Amount of long-term debt and lease obligation, classified as current.","long-term debt, lease obligation, current",-159809570.1000604,-11000000.0,592404201.1033483,-14827000000.0,-480.0,4967,-57000000.0,-2000000.0
2744,PreferredStockDividendsAndOtherAdjustments,2,D,1,The aggregate value of preferred stock dividends and other adjustments necessary to derive net income apportioned to common stockholders.,"preferred stock dividends, other adjustments",35137919.95555556,4655500.0,118425411.72691718,24.0,1513000000.0,990,1101750.0,17263000.0
2746,OffMarketLeaseUnfavorable,2,C,-1,This element represents a liability associated with the acquisition of an off-market lease when the terms of the lease are unfavorable to the market terms for the lease at the date of acquisition.,"off-market lease, unfavorable",-81395736.84210527,-29627500.0,110080332.67565525,-396423000.0,-97000.0,38,-137171250.0,-13724250.0
2758,StandardProductWarrantyAccrualCurrent,2,C,-1,"Amount as of the balance sheet date of the aggregate standard product warranty liability that is expected to be paid within one year or the normal operating cycle, if longer. Does not include the balance for the extended product warranty liability.","standard product warranty accrual, current",-98829200.0,-16221000.0,148266535.84252536,-345197000.0,-6525000.0,15,-172434000.0,-11534500.0
2763,NotesPayableCurrent,2,C,-1,Sum of the carrying values as of the balance sheet date of the portions of long-term notes payable due within one year or the operating cycle if longer.,"notes payable, current",-64282103.95434298,-2334245.5,395829419.9573468,-6321000000.0,-480.0,898,-10250000.0,-422672.5
2764,ContractWithCustomerLiabilityCurrent,3,C,-1,"Amount of obligation to transfer good or service to customer for which consideration has been received or is receivable, classified as current.","contract with customer, liability, current",-485153744.54466957,-24703000.0,2913646424.648219,-55924000000.0,-996.0,3011,-164195000.0,-3240500.0
2772,ConvertibleNotesPayableCurrent,2,C,-1,"Carrying value as of the balance sheet date of the portion of long-term debt due within one year or the operating cycle if longer identified as Convertible Notes Payable. Convertible Notes Payable is a written promise to pay a note which can be exchanged for a specified amount of another, related security, at the option of the issuer and the holder.","convertible notes payable, current",-30856404.542857144,-2852160.0,125073427.993404,-1204177000.0,-480.0,245,-10327778.0,-676206.0
2781,UndistributedEarningsLossAllocatedToParticipatingSecuritiesBasic,2,D,1,Amount of undistributed earnings (loss) allocated to participating securities for the basic earnings (loss) per share or per unit calculation under the two-class method.,"undistributed earnings (loss) allocated to participating securities, basic",9530610.692307692,952000.0,28069285.213365227,1000.0,180394000.0,65,320000.0,2712000.0
2785,OtherLoansPayableCurrent,2,C,-1,"Amount of long-term loans classified as other, payable within one year or the operating cycle, if longer.","other loans payable, current",-1510294.5263157894,-243759.0,2184819.0983474115,-6786000.0,-30646.0,19,-2071662.5,-53500.0
2792,PreferredStockRedemptionPremium,1,D,1,"The excess of (1) fair value of the consideration transferred to the holders of the preferred stock over (2) the carrying amount of the preferred stock in the registrant's balance sheet, during the accounting period.",preferred stock redemption premium,101208411.76470588,26678000.0,207237679.8844321,1380000.0,803000000.0,17,6200000.0,65000000.0
2798,NoncontrollingInterestInNetIncomeLossJointVenturePartnersNonredeemable,2,D,1,"Amount after tax of income (loss) attributable to nonredeemable noncontrolling shareholder, unit holder, partner, or other equity holder of a joint venture.","noncontrolling interest in net income (loss) joint venture partners, nonredeemable",7132187.5,5689000.0,7390554.712773595,154000.0,26250000.0,16,568250.0,11421250.0
2799,AccruedSalariesCurrent,2,C,-1,Carrying value as of the balance sheet date of the obligations incurred through that date and payable for employees' services provided. Used to reflect the current portion of the liabilities (due within one year or within the normal operating cycle if longer).,"accrued salaries, current",-135124753.63432837,-27026000.0,324734123.15341777,-1746000000.0,-75000.0,134,-83832000.0,-7992500.0
2806,NoncontrollingInterestInNetIncomeLossLimitedPartnershipsRedeemable,2,D,1,Amount after tax of income (loss) attributable to redeemable noncontrolling partner of a limited partnership.,"noncontrolling interest in net income (loss) limited partnerships, redeemable",18912071.42857143,3068500.0,31189047.437705252,571000.0,94783000.0,14,2419000.0,10052250.0
2809,FinanceLeaseLiabilityCurrent,3,C,-1,"Present value of lessee's discounted obligation for lease payments from finance lease, classified as current.","finance lease, liability, current",-12862494.356435644,-706734.0,81247751.69847192,-1286000000.0,-1000.0,1212,-3557250.0,-121750.0
2812,InterestPayableCurrent,2,C,-1,"Carrying value as of the balance sheet date of [accrued] interest payable on all forms of debt, including trade payables, that has been incurred and is unpaid. Used to reflect the current portion of the liabilities (due within one year or within the normal operating cycle if longer).","interest payable, current",-53715085.591724135,-17000000.0,90305753.32102945,-610000000.0,-123.0,725,-60901000.0,-2234000.0
2814,OtherUnderwritingExpense,1,D,1,"Costs incurred during the period, such as those relating to general administration and policy maintenance that do not vary with and are not primarily related to the acquisition or renewal of insurance contracts.",other underwriting expense,428733182.8333333,114180079.5,1091586207.6278512,6871619.0,5859600000.0,54,52812000.0,213083750.0
2815,CommercialPaper,1,C,-1,"Carrying value as of the balance sheet date of short-term borrowings using unsecured obligations issued by banks, corporations and other borrowers to investors. The maturities of these money market securities generally do not exceed 270 days.",commercial paper,-1235211000.0,-285000000.0,4108544493.254944,-25808000000.0,-15327000.0,39,-549612000.0,-123750000.0
2816,AccruedReclamationCostsCurrent,2,C,-1,Current portion of reclamation reserve to restore a mining or drilling site to the condition agreed upon within the mining or drilling contract.,"accrued reclamation costs, current",-9291750.0,-9142000.0,885987.7256486117,-10352000.0,-8531000.0,4,-9857750.0,-8576000.0
2817,OccupancyNet,2,D,1,"Amount of net occupancy expense that may include items, such as depreciation of facilities and equipment, lease expenses, property taxes and property and casualty insurance expense.","occupancy, net",71512945.00990991,7292500.0,356750017.1883836,131000.0,7071000000.0,1110,2506250.0,24440000.0
